{
  "schema": "gis-ai-go.qual-206-local-protocol-evidence-matrix.v1",
  "classification": "repository-only-non-live-unscored",
  "schema_contract": {
    "path": "schemas/qual-206-local-protocol-evidence-matrix.schema.json",
    "sha256": "e0955da7969213e1d54efed53c3e22ac796dd2ef426f3f1ca56c30a99625aa73"
  },
  "repository_binding": {
    "kind": "repository-material-bound",
    "runtime_base_commit": "a33876b16ac7c198e75773fc79097d2f2836cf13",
    "material_integrity": "sha256",
    "runtime_materials": [
      {
        "path": "apps/mcp-gateway/src/governed-assembly.ts",
        "sha256": "8a73efc2cf38fa434ca663c45eb0ff21c3c57c87b1892f74ce16482184eceeb0"
      },
      {
        "path": "apps/mcp-gateway/src/mcp-http.ts",
        "sha256": "bcbebca4c5a0b86ee9c6a3c191cbc683b65e94fef2294835acbd792f869b0ad9"
      },
      {
        "path": "apps/mcp-gateway/src/mcp-request-signal.ts",
        "sha256": "5c766fdff14044e1f261f4a688517ca2688c5a9fcb15f7c35294c073c99e6726"
      },
      {
        "path": "apps/mcp-gateway/src/mcp-server.ts",
        "sha256": "e2c5cec027f3049d0a501b885a0ab6336d7e6059690df54ac7b257945807b454"
      },
      {
        "path": "apps/mcp-gateway/src/mcp-stdio.ts",
        "sha256": "5e8d87020d1efe34b2b83940f60d2df5926f466c12473fffc156463c9a6cef30"
      }
    ]
  },
  "protocol": {
    "name": "Model Context Protocol",
    "version": "2026-07-28"
  },
  "official_client": {
    "package": "@modelcontextprotocol/client",
    "version": "2.0.0",
    "manifest": {
      "path": "apps/mcp-gateway/package.json",
      "sha256": "fd7fc20b11df26f2b3c4eef13eee2ae3f3f08b1fa00cd83abcf7f73ab7f432d1"
    },
    "lockfile": {
      "path": "pnpm-lock.yaml",
      "sha256": "640208aa66d26241514025b33dbde50bc14be7bbd33641eec9977e87699bb4ec"
    }
  },
  "coverage": [
    {
      "id": "official-http",
      "driver": "official-client",
      "transport": "http",
      "wiring": "in-process-fetch-and-loopback",
      "test_sources": [
        {
          "path": "apps/mcp-gateway/test/mcp-transport.test.ts",
          "sha256": "8826d5f6bdd96e9bdd9d5c4e9175e7a3da8d3ff957e4caa2f92d3d28437e7688",
          "source_test_names": [
            "interoperates with the pinned v2 SDK client for tools and resources",
            "interoperates through the real bounded loopback Node ingress"
          ]
        }
      ],
      "covers": {
        "protocol_2026_07_28": true,
        "cancellation": false,
        "unsupported_traffic": false
      }
    },
    {
      "id": "official-stdio",
      "driver": "official-client",
      "transport": "stdio",
      "wiring": "real-process-stdio",
      "test_sources": [
        {
          "path": "apps/mcp-gateway/test/mcp-stdio.test.ts",
          "sha256": "1b866688485bf242821aab37a8130b6d31d3a118a48908e3092fce754ed4d383",
          "source_test_names": [
            "interoperates with the pinned official STDIO client in an enabled subprocess"
          ]
        }
      ],
      "covers": {
        "protocol_2026_07_28": true,
        "cancellation": false,
        "unsupported_traffic": false
      }
    },
    {
      "id": "raw-http",
      "driver": "raw-transcript",
      "transport": "http",
      "wiring": "in-process-fetch",
      "test_sources": [
        {
          "path": "apps/mcp-gateway/test/mcp-transport.test.ts",
          "sha256": "8826d5f6bdd96e9bdd9d5c4e9175e7a3da8d3ff957e4caa2f92d3d28437e7688",
          "source_test_names": [
            "requires both HTTP Accept media types before entering the SDK",
            "rejects every unsafe JSON-RPC request ID before SDK dispatch",
            "guards the SDK 2.0.0 missing protocol-version header defect narrowly",
            "leaves unsupported revisions and cross-header mismatches to the pinned SDK"
          ]
        },
        {
          "path": "apps/mcp-gateway/test/public-read-transport.test.ts",
          "sha256": "1760580b5a01d7a792d9a4a90089b4e98d260cc50501d3c0d1bf14113a03cfee",
          "source_test_names": [
            "propagates modern MCP HTTP cancellation with no receipt or ledger event"
          ]
        }
      ],
      "covers": {
        "protocol_2026_07_28": true,
        "cancellation": true,
        "unsupported_traffic": true
      }
    },
    {
      "id": "raw-stdio",
      "driver": "raw-transcript",
      "transport": "stdio",
      "wiring": "in-process-and-real-process-stdio",
      "test_sources": [
        {
          "path": "apps/mcp-gateway/test/mcp-stdio.test.ts",
          "sha256": "1b866688485bf242821aab37a8130b6d31d3a118a48908e3092fce754ed4d383",
          "source_test_names": [
            "serves a raw modern STDIO transcript through the same registered factory",
            "rejects every unsafe STDIO request ID before application dispatch",
            "rejects a legacy STDIO opening without pinning the connection to it",
            "bounds the reply to an exactly 1 MiB subprocess request with a huge ID",
            "keeps the executable stdout protocol-clean with frozen zero activation"
          ]
        },
        {
          "path": "apps/mcp-gateway/test/public-read-transport.test.ts",
          "sha256": "1760580b5a01d7a792d9a4a90089b4e98d260cc50501d3c0d1bf14113a03cfee",
          "source_test_names": [
            "honours STDIO cancellation without a response, receipt or ledger event"
          ]
        }
      ],
      "covers": {
        "protocol_2026_07_28": true,
        "cancellation": true,
        "unsupported_traffic": true
      }
    }
  ],
  "exact_five_stdio": {
    "transport": "stdio",
    "driver": "raw-transcript",
    "wiring": "real-process-stdio",
    "source_base_commit": "fedba12b619e9be6e443e8b249d680b26f73ce9e",
    "test_source": {
      "path": "tests/interoperability/test_qual_206_exact_five_stdio.mjs",
      "sha256": "5e8a250771ba8f2ff62c02ab9259f4bbd3a8e5b5ce4d76a6f0d73561723f2c50",
      "source_test_names": [
        "fails closed unless the exact-five subprocess authority is complete",
        "serves the exact five operations and catalogue resources through real STDIO pipes",
        "cancels a real-process data query without response or completed evidence",
        "rejects unsupported real-process STDIO traffic without provider dispatch"
      ]
    },
    "fixture_source": {
      "path": "tests/interoperability/fixtures/qual_206_exact_five_stdio_server.mjs",
      "sha256": "c7da5d258cce9addd2ebf7180138756ee5531b47f1a283e0d54a9a8e84f9aa18"
    },
    "runner_source": {
      "path": "apps/mcp-gateway/test/qual-206-local-protocol-matrix.test.ts",
      "sha256": "0329b39243e629d611784b22fb560a349d13ebd035d61fd0e9926aff5712fb2c"
    },
    "operations": [
      "catalogue.search",
      "catalogue.describe",
      "selection.resolve",
      "data.query",
      "evidence.inspect"
    ],
    "resources": [
      "catalogue.public",
      "catalogue.record",
      "evidence.receipt"
    ],
    "checks": [
      "fail-closed-authority",
      "fragmented-os-pipe-framing",
      "server/discover",
      "tools/list-exact-five",
      "resources/list",
      "resources/templates/list",
      "resources/read-catalogue",
      "resources/read-record",
      "resources/read-evidence",
      "tools/call-one-per-operation",
      "structured-plain-text-parity",
      "cancellation-no-response-or-completed-evidence",
      "unsupported-traffic"
    ],
    "deterministic_provider_transport": "injected-fixed-ons-fixture",
    "live_provider_calls": 0,
    "production_registration": false,
    "operating_system_pipe_framing": true
  },
  "suspension_stdio": {
    "transport": "stdio",
    "driver": "raw-transcript",
    "wiring": "real-process-stdio",
    "test_source": {
      "path": "tests/interoperability/test_qual_206_exact_five_stdio.mjs",
      "sha256": "5e8a250771ba8f2ff62c02ab9259f4bbd3a8e5b5ce4d76a6f0d73561723f2c50",
      "source_test_names": [
        "keeps all seven governed suspensions absent and uncallable through real STDIO pipes"
      ]
    },
    "fixture_source": {
      "path": "tests/interoperability/fixtures/qual_206_exact_five_stdio_server.mjs",
      "sha256": "c7da5d258cce9addd2ebf7180138756ee5531b47f1a283e0d54a9a8e84f9aa18"
    },
    "runner_source": {
      "path": "apps/mcp-gateway/test/qual-206-local-protocol-matrix.test.ts",
      "sha256": "0329b39243e629d611784b22fb560a349d13ebd035d61fd0e9926aff5712fb2c"
    },
    "scenario_count": 7,
    "resulting_suspension_count": 9,
    "checks": [
      "server/discover",
      "tools/list",
      "resources/list",
      "resources/templates/list",
      "tools/call-advertised",
      "tools/call-suspended"
    ],
    "production_registration": false,
    "provider_network_calls": 0,
    "operating_system_pipe_framing": true
  },
  "claims": {
    "complete_qual_206": false,
    "scored_evaluation": false,
    "test_execution_recorded": false,
    "live_host_session": false,
    "desktop_host_acceptance": false,
    "remote_host_acceptance": false,
    "live_provider_call": false,
    "production_activation": false,
    "public_deployment": false,
    "public_registration": false,
    "release_acceptance": false
  },
  "boundary": "Repository-material-bound deterministic source matrix. It is repository-only, non-live and unscored; coverage rows and subprocess sections bind source declarations but do not record a test-runner outcome. The exact-five and suspension regressions use test-only real-process STDIO with operating-system pipes and an injected zero-network fixture; the matrix does not complete host interoperability or authorise activation, deployment, registration or release.",
  "matrix_id": "gis-ai-go:qual-206-local-protocol-evidence-matrix:sha256:3e596d1cb277809c6382604c1c004bc205223984778fcfcb4ba7c897799602a5"
}
